    1  07:36:46.782416 IP ip-172-31-44-253.us-west-2.compute.internal.ssh > 115.178.215.137.6028: Flags [P.], seq 1462215299:1462215407, ack 380367922, win 853, options [nop,nop,TS val 3934726 ecr 4281065], length 108
    2  07:36:46.782463 IP ip-172-31-44-253.us-west-2.compute.internal.ssh > 115.178.215.137.6028: Flags [P.], seq 108:252, ack 1, win 853, options [nop,nop,TS val 3934726 ecr 4281065], length 144
    3  07:36:46.782518 IP ip-172-31-44-253.us-west-2.compute.internal.ssh > 115.178.215.137.6028: Flags [P.], seq 252:288, ack 1, win 853, options [nop,nop,TS val 3934726 ecr 4281065], length 36
    4  07:36:47.018900 IP 115.178.215.137.6028 > ip-172-31-44-253.us-west-2.compute.internal.ssh: Flags [.], ack 0, win 1444, options [nop,nop,TS val 4281133 ecr 3934720], length 0
    5  07:36:47.018913 IP 115.178.215.137.6028 > ip-172-31-44-253.us-west-2.compute.internal.ssh: Flags [.], ack 108, win 1444, options [nop,nop,TS val 4281135 ecr 3934726], length 0
    6  07:36:47.018932 IP 115.178.215.137.6028 > ip-172-31-44-253.us-west-2.compute.internal.ssh: Flags [.], ack 252, win 1444, options [nop,nop,TS val 4281135 ecr 3934726], length 0
    7  07:36:47.018972 IP 115.178.215.137.6028 > ip-172-31-44-253.us-west-2.compute.internal.ssh: Flags [.], ack 288, win 1444, options [nop,nop,TS val 4281135 ecr 3934726], length 0
    8  07:36:47.778638 IP ip-172-31-44-253.us-west-2.compute.internal.52567 > ip-172-31-0-2.us-west-2.compute.internal.domain: 48564+ PTR? 137.215.178.115.in-addr.arpa. (46)
    9  07:36:47.959616 IP ip-172-31-0-2.us-west-2.compute.internal.domain > ip-172-31-44-253.us-west-2.compute.internal.52567: 48564 NXDomain 0/1/0 (135)
   10  07:36:47.959752 IP ip-172-31-44-253.us-west-2.compute.internal.58140 > ip-172-31-0-2.us-west-2.compute.internal.domain: 9690+ PTR? 253.44.31.172.in-addr.arpa. (44)
   11  07:36:47.961012 IP ip-172-31-0-2.us-west-2.compute.internal.domain > ip-172-31-44-253.us-west-2.compute.internal.58140: 9690 1/0/0 PTR ip-172-31-44-253.us-west-2.compute.internal. (101)
   12  07:36:48.778335 IP ip-172-31-44-253.us-west-2.compute.internal.55979 > ip-172-31-0-2.us-west-2.compute.internal.domain: 59247+ PTR? 2.0.31.172.in-addr.arpa. (41)
   13  07:36:48.780187 IP ip-172-31-0-2.us-west-2.compute.internal.domain > ip-172-31-44-253.us-west-2.compute.internal.55979: 59247 1/0/0 PTR ip-172-31-0-2.us-west-2.compute.internal. (95)
   14  07:36:58.126250 IP 152.118.27.67.43210 > ip-172-31-44-253.us-west-2.compute.internal.http: Flags [S], seq 1668345068, win 29200, options [mss 1460,sackOK,TS val 1865567 ecr 0,nop,wscale 6], length 0
   15  07:36:58.126274 IP ip-172-31-44-253.us-west-2.compute.internal.http > 152.118.27.67.43210: Flags [S.], seq 3820580281, ack 1668345069, win 26847, options [mss 8961,sackOK,TS val 3937562 ecr 1865567,nop,wscale 7], length 0
   16  07:36:58.362887 IP 152.118.27.67.43210 > ip-172-31-44-253.us-west-2.compute.internal.http: Flags [.], ack 1, win 457, options [nop,nop,TS val 1865591 ecr 3937562], length 0
   17  07:36:58.364947 IP 152.118.27.67.43210 > ip-172-31-44-253.us-west-2.compute.internal.http: Flags [P.], seq 1:242, ack 1, win 457, options [nop,nop,TS val 1865591 ecr 3937562], length 241: HTTP: POST /api/v01/post/data/add HTTP/1.1
   18  07:36:58.364967 IP ip-172-31-44-253.us-west-2.compute.internal.http > 152.118.27.67.43210: Flags [.], ack 242, win 219, options [nop,nop,TS val 3937621 ecr 1865591], length 0
   19  07:36:58.382436 IP ip-172-31-44-253.us-west-2.compute.internal.36977 > ip-172-31-0-2.us-west-2.compute.internal.domain: 54020+ A? c02.cxhy9bpkxdlw.us-west-2.rds.amazonaws.com. (62)
   20  07:36:58.382444 IP ip-172-31-44-253.us-west-2.compute.internal.36977 > ip-172-31-0-2.us-west-2.compute.internal.domain: 16542+ AAAA? c02.cxhy9bpkxdlw.us-west-2.rds.amazonaws.com. (62)
   21  07:36:58.401609 IP ip-172-31-0-2.us-west-2.compute.internal.domain > ip-172-31-44-253.us-west-2.compute.internal.36977: 54020 2/0/0 CNAME ec2-52-33-228-254.us-west-2.compute.amazonaws.com., A 172.31.27.149 (128)
   22  07:36:58.406350 IP ip-172-31-0-2.us-west-2.compute.internal.domain > ip-172-31-44-253.us-west-2.compute.internal.36977: 16542 1/1/0 CNAME ec2-52-33-228-254.us-west-2.compute.amazonaws.com. (196)
   23  07:36:58.406444 IP ip-172-31-44-253.us-west-2.compute.internal.59260 > ip-172-31-27-149.us-west-2.compute.internal.mysql: Flags [S], seq 1431617260, win 26883, options [mss 8961,sackOK,TS val 3937632 ecr 0,nop,wscale 7], length 0
   24  07:36:58.407500 IP ip-172-31-27-149.us-west-2.compute.internal.mysql > ip-172-31-44-253.us-west-2.compute.internal.59260: Flags [S.], seq 1670996534, ack 1431617261, win 28960, options [mss 1460,sackOK,TS val 46670334 ecr 3937632,nop,wscale 7], length 0
   25  07:36:58.407513 IP ip-172-31-44-253.us-west-2.compute.internal.59260 > ip-172-31-27-149.us-west-2.compute.internal.mysql: Flags [.], ack 1, win 211, options [nop,nop,TS val 3937632 ecr 46670334], length 0
   26  07:36:58.408460 IP ip-172-31-27-149.us-west-2.compute.internal.mysql > ip-172-31-44-253.us-west-2.compute.internal.59260: Flags [P.], seq 1:83, ack 1, win 227, options [nop,nop,TS val 46670334 ecr 3937632], length 82
   27  07:36:58.408469 IP ip-172-31-44-253.us-west-2.compute.internal.59260 > ip-172-31-27-149.us-west-2.compute.internal.mysql: Flags [.], ack 83, win 211, options [nop,nop,TS val 3937632 ecr 46670334], length 0
   28  07:36:58.408638 IP ip-172-31-44-253.us-west-2.compute.internal.59260 > ip-172-31-27-149.us-west-2.compute.internal.mysql: Flags [P.], seq 1:94, ack 83, win 211, options [nop,nop,TS val 3937632 ecr 46670334], length 93
   29  07:36:58.409381 IP ip-172-31-27-149.us-west-2.compute.internal.mysql > ip-172-31-44-253.us-west-2.compute.internal.59260: Flags [.], ack 94, win 227, options [nop,nop,TS val 46670334 ecr 3937632], length 0
   30  07:36:58.409455 IP ip-172-31-27-149.us-west-2.compute.internal.mysql > ip-172-31-44-253.us-west-2.compute.internal.59260: Flags [P.], seq 83:94, ack 94, win 227, options [nop,nop,TS val 46670334 ecr 3937632], length 11
   31  07:36:58.409496 IP ip-172-31-44-253.us-west-2.compute.internal.59260 > ip-172-31-27-149.us-west-2.compute.internal.mysql: Flags [P.], seq 94:117, ack 94, win 211, options [nop,nop,TS val 3937632 ecr 46670334], length 23
   32  07:36:58.410392 IP ip-172-31-27-149.us-west-2.compute.internal.mysql > ip-172-31-44-253.us-west-2.compute.internal.59260: Flags [P.], seq 94:105, ack 117, win 227, options [nop,nop,TS val 46670335 ecr 3937632], length 11
   33  07:36:58.410924 IP ip-172-31-44-253.us-west-2.compute.internal.59260 > ip-172-31-27-149.us-west-2.compute.internal.mysql: Flags [P.], seq 117:152, ack 105, win 211, options [nop,nop,TS val 3937633 ecr 46670335], length 35
   34  07:36:58.412055 IP ip-172-31-27-149.us-west-2.compute.internal.mysql > ip-172-31-44-253.us-west-2.compute.internal.59260: Flags [P.], seq 105:333, ack 152, win 227, options [nop,nop,TS val 46670335 ecr 3937633], length 228
   35  07:36:58.412510 IP ip-172-31-44-253.us-west-2.compute.internal.59260 > ip-172-31-27-149.us-west-2.compute.internal.mysql: Flags [P.], seq 152:174, ack 333, win 219, options [nop,nop,TS val 3937633 ecr 46670335], length 22
   36  07:36:58.413437 IP ip-172-31-27-149.us-west-2.compute.internal.mysql > ip-172-31-44-253.us-west-2.compute.internal.59260: Flags [P.], seq 333:400, ack 174, win 227, options [nop,nop,TS val 46670335 ecr 3937633], length 67
   37  07:36:58.413612 IP ip-172-31-44-253.us-west-2.compute.internal.59260 > ip-172-31-27-149.us-west-2.compute.internal.mysql: Flags [P.], seq 174:200, ack 400, win 219, options [nop,nop,TS val 3937633 ecr 46670335], length 26
   38  07:36:58.414487 IP ip-172-31-27-149.us-west-2.compute.internal.mysql > ip-172-31-44-253.us-west-2.compute.internal.59260: Flags [P.], seq 400:483, ack 200, win 227, options [nop,nop,TS val 46670336 ecr 3937633], length 83
   39  07:36:58.414666 IP ip-172-31-44-253.us-west-2.compute.internal.59260 > ip-172-31-27-149.us-west-2.compute.internal.mysql: Flags [P.], seq 200:273, ack 483, win 219, options [nop,nop,TS val 3937634 ecr 46670336], length 73
   40  07:36:58.418773 IP ip-172-31-27-149.us-west-2.compute.internal.mysql > ip-172-31-44-253.us-west-2.compute.internal.59260: Flags [P.], seq 483:1020, ack 273, win 227, options [nop,nop,TS val 46670336 ecr 3937634], length 537
   41  07:36:58.419585 IP ip-172-31-44-253.us-west-2.compute.internal.59260 > ip-172-31-27-149.us-west-2.compute.internal.mysql: Flags [P.], seq 273:333, ack 1020, win 227, options [nop,nop,TS val 3937635 ecr 46670336], length 60
   42  07:36:58.420487 IP ip-172-31-27-149.us-west-2.compute.internal.mysql > ip-172-31-44-253.us-west-2.compute.internal.59260: Flags [P.], seq 1020:1098, ack 333, win 227, options [nop,nop,TS val 46670337 ecr 3937635], length 78
   43  07:36:58.420859 IP ip-172-31-44-253.us-west-2.compute.internal.59260 > ip-172-31-27-149.us-west-2.compute.internal.mysql: Flags [P.], seq 333:395, ack 1098, win 227, options [nop,nop,TS val 3937635 ecr 46670337], length 62
   44  07:36:58.421739 IP ip-172-31-27-149.us-west-2.compute.internal.mysql > ip-172-31-44-253.us-west-2.compute.internal.59260: Flags [P.], seq 1098:1178, ack 395, win 227, options [nop,nop,TS val 46670338 ecr 3937635], length 80
   45  07:36:58.422203 IP ip-172-31-44-253.us-west-2.compute.internal.59260 > ip-172-31-27-149.us-west-2.compute.internal.mysql: Flags [P.], seq 395:490, ack 1178, win 227, options [nop,nop,TS val 3937636 ecr 46670338], length 95
   46  07:36:58.423102 IP ip-172-31-27-149.us-west-2.compute.internal.mysql > ip-172-31-44-253.us-west-2.compute.internal.59260: Flags [P.], seq 1178:1259, ack 490, win 227, options [nop,nop,TS val 46670338 ecr 3937636], length 81
   47  07:36:58.423242 IP ip-172-31-44-253.us-west-2.compute.internal.59260 > ip-172-31-27-149.us-west-2.compute.internal.mysql: Flags [P.], seq 490:503, ack 1259, win 227, options [nop,nop,TS val 3937636 ecr 46670338], length 13
   48  07:36:58.424073 IP ip-172-31-27-149.us-west-2.compute.internal.mysql > ip-172-31-44-253.us-west-2.compute.internal.59260: Flags [P.], seq 1259:1270, ack 503, win 227, options [nop,nop,TS val 46670338 ecr 3937636], length 11
   49  07:36:58.424800 IP ip-172-31-44-253.us-west-2.compute.internal.59260 > ip-172-31-27-149.us-west-2.compute.internal.mysql: Flags [P.], seq 503:685, ack 1270, win 227, options [nop,nop,TS val 3937636 ecr 46670338], length 182
   50  07:36:58.425772 IP ip-172-31-27-149.us-west-2.compute.internal.mysql > ip-172-31-44-253.us-west-2.compute.internal.59260: Flags [P.], seq 1270:1594, ack 685, win 235, options [nop,nop,TS val 46670339 ecr 3937636], length 324
   51  07:36:58.427833 IP ip-172-31-44-253.us-west-2.compute.internal.59260 > ip-172-31-27-149.us-west-2.compute.internal.mysql: Flags [P.], seq 685:824, ack 1594, win 236, options [nop,nop,TS val 3937637 ecr 46670339], length 139
   52  07:36:58.428874 IP ip-172-31-27-149.us-west-2.compute.internal.mysql > ip-172-31-44-253.us-west-2.compute.internal.59260: Flags [P.], seq 1594:1605, ack 824, win 243, options [nop,nop,TS val 46670339 ecr 3937637], length 11
   53  07:36:58.429300 IP ip-172-31-44-253.us-west-2.compute.internal.59260 > ip-172-31-27-149.us-west-2.compute.internal.mysql: Flags [P.], seq 824:835, ack 1605, win 236, options [nop,nop,TS val 3937637 ecr 46670339], length 11
   54  07:36:58.434312 IP ip-172-31-27-149.us-west-2.compute.internal.mysql > ip-172-31-44-253.us-west-2.compute.internal.59260: Flags [P.], seq 1605:1616, ack 835, win 243, options [nop,nop,TS val 46670341 ecr 3937637], length 11
   55  07:36:58.434483 IP ip-172-31-44-253.us-west-2.compute.internal.59260 > ip-172-31-27-149.us-west-2.compute.internal.mysql: Flags [P.], seq 835:848, ack 1616, win 236, options [nop,nop,TS val 3937639 ecr 46670341], length 13
   56  07:36:58.435341 IP ip-172-31-27-149.us-west-2.compute.internal.mysql > ip-172-31-44-253.us-west-2.compute.internal.59260: Flags [P.], seq 1616:1627, ack 848, win 243, options [nop,nop,TS val 46670341 ecr 3937639], length 11
   57  07:36:58.436506 IP ip-172-31-44-253.us-west-2.compute.internal.59260 > ip-172-31-27-149.us-west-2.compute.internal.mysql: Flags [P.], seq 848:1106, ack 1627, win 236, options [nop,nop,TS val 3937639 ecr 46670341], length 258
   58  07:36:58.437496 IP ip-172-31-27-149.us-west-2.compute.internal.mysql > ip-172-31-44-253.us-west-2.compute.internal.59260: Flags [P.], seq 1627:2084, ack 1106, win 252, options [nop,nop,TS val 46670341 ecr 3937639], length 457
   59  07:36:58.438957 IP ip-172-31-44-253.us-west-2.compute.internal.59260 > ip-172-31-27-149.us-west-2.compute.internal.mysql: Flags [P.], seq 1106:1214, ack 2084, win 244, options [nop,nop,TS val 3937640 ecr 46670341], length 108
   60  07:36:58.439931 IP ip-172-31-27-149.us-west-2.compute.internal.mysql > ip-172-31-44-253.us-west-2.compute.internal.59260: Flags [P.], seq 2084:2275, ack 1214, win 252, options [nop,nop,TS val 46670342 ecr 3937640], length 191
   61  07:36:58.440729 IP ip-172-31-44-253.us-west-2.compute.internal.59260 > ip-172-31-27-149.us-west-2.compute.internal.mysql: Flags [P.], seq 1214:1286, ack 2275, win 252, options [nop,nop,TS val 3937640 ecr 46670342], length 72
   62  07:36:58.441763 IP ip-172-31-27-149.us-west-2.compute.internal.mysql > ip-172-31-44-253.us-west-2.compute.internal.59260: Flags [P.], seq 2275:2327, ack 1286, win 252, options [nop,nop,TS val 46670343 ecr 3937640], length 52
   63  07:36:58.442095 IP ip-172-31-44-253.us-west-2.compute.internal.59260 > ip-172-31-27-149.us-west-2.compute.internal.mysql: Flags [P.], seq 1286:1297, ack 2327, win 252, options [nop,nop,TS val 3937640 ecr 46670343], length 11
   64  07:36:58.446920 IP ip-172-31-27-149.us-west-2.compute.internal.mysql > ip-172-31-44-253.us-west-2.compute.internal.59260: Flags [P.], seq 2327:2338, ack 1297, win 252, options [nop,nop,TS val 46670344 ecr 3937640], length 11
   65  07:36:58.447040 IP ip-172-31-44-253.us-west-2.compute.internal.59260 > ip-172-31-27-149.us-west-2.compute.internal.mysql: Flags [P.], seq 1297:1310, ack 2338, win 252, options [nop,nop,TS val 3937642 ecr 46670344], length 13
   66  07:36:58.447906 IP ip-172-31-27-149.us-west-2.compute.internal.mysql > ip-172-31-44-253.us-west-2.compute.internal.59260: Flags [P.], seq 2338:2349, ack 1310, win 252, options [nop,nop,TS val 46670344 ecr 3937642], length 11
   67  07:36:58.448682 IP ip-172-31-44-253.us-west-2.compute.internal.59260 > ip-172-31-27-149.us-west-2.compute.internal.mysql: Flags [P.], seq 1310:1568, ack 2349, win 252, options [nop,nop,TS val 3937642 ecr 46670344], length 258
   68  07:36:58.449677 IP ip-172-31-27-149.us-west-2.compute.internal.mysql > ip-172-31-44-253.us-west-2.compute.internal.59260: Flags [P.], seq 2349:2806, ack 1568, win 260, options [nop,nop,TS val 46670345 ecr 3937642], length 457
   69  07:36:58.450504 IP ip-172-31-44-253.us-west-2.compute.internal.59260 > ip-172-31-27-149.us-west-2.compute.internal.mysql: Flags [P.], seq 1568:1581, ack 2806, win 261, options [nop,nop,TS val 3937643 ecr 46670345], length 13
   70  07:36:58.451404 IP ip-172-31-27-149.us-west-2.compute.internal.mysql > ip-172-31-44-253.us-west-2.compute.internal.59260: Flags [P.], seq 2806:2817, ack 1581, win 260, options [nop,nop,TS val 46670345 ecr 3937643], length 11
   71  07:36:58.451700 IP ip-172-31-44-253.us-west-2.compute.internal.ssh > 115.178.215.137.6028: Flags [P.], seq 288:412, ack 1, win 853, options [nop,nop,TS val 3937643 ecr 4281135], length 124
   72  07:36:58.451760 IP ip-172-31-44-253.us-west-2.compute.internal.http > 152.118.27.67.43210: Flags [P.], seq 1:18, ack 242, win 219, options [nop,nop,TS val 3937643 ecr 1865591], length 17: HTTP: HTTP/1.0 200 OK
   73  07:36:58.451771 IP ip-172-31-44-253.us-west-2.compute.internal.ssh > 115.178.215.137.6028: Flags [P.], seq 412:448, ack 1, win 853, options [nop,nop,TS val 3937643 ecr 4281135], length 36
   74  07:36:58.451846 IP ip-172-31-44-253.us-west-2.compute.internal.http > 152.118.27.67.43210: Flags [FP.], seq 18:168, ack 242, win 219, options [nop,nop,TS val 3937643 ecr 1865591], length 150: HTTP
   75  07:36:58.490181 IP ip-172-31-44-253.us-west-2.compute.internal.59260 > ip-172-31-27-149.us-west-2.compute.internal.mysql: Flags [.], ack 2817, win 261, options [nop,nop,TS val 3937653 ecr 46670345], length 0
   76  07:36:58.688481 IP 152.118.27.67.43210 > ip-172-31-44-253.us-west-2.compute.internal.http: Flags [.], ack 18, win 457, options [nop,nop,TS val 1865623 ecr 3937643], length 0
   77  07:36:58.697654 IP 152.118.27.67.43210 > ip-172-31-44-253.us-west-2.compute.internal.http: Flags [F.], seq 242, ack 169, win 473, options [nop,nop,TS val 1865624 ecr 3937643], length 0
   78  07:36:58.697665 IP ip-172-31-44-253.us-west-2.compute.internal.http > 152.118.27.67.43210: Flags [.], ack 243, win 219, options [nop,nop,TS val 3937704 ecr 1865624], length 0
   79  07:36:58.698869 IP 115.178.215.137.6028 > ip-172-31-44-253.us-west-2.compute.internal.ssh: Flags [.], ack 448, win 1444, options [nop,nop,TS val 4284054 ecr 3937643], length 0
   80  07:36:58.698890 IP 115.178.215.137.6028 > ip-172-31-44-253.us-west-2.compute.internal.ssh: Flags [.], ack 412, win 1444, options [nop,nop,TS val 4284054 ecr 3937643], length 0
   81  07:36:58.778306 IP ip-172-31-44-253.us-west-2.compute.internal.51062 > ip-172-31-0-2.us-west-2.compute.internal.domain: 50105+ PTR? 67.27.118.152.in-addr.arpa. (44)
   82  07:37:01.057727 IP ip-172-31-0-2.us-west-2.compute.internal.domain > ip-172-31-44-253.us-west-2.compute.internal.51062: 50105 NXDomain 0/1/0 (108)
   83  07:37:01.057951 IP ip-172-31-44-253.us-west-2.compute.internal.39529 > ip-172-31-0-2.us-west-2.compute.internal.domain: 36938+ PTR? 149.27.31.172.in-addr.arpa. (44)
   84  07:37:01.059397 IP ip-172-31-0-2.us-west-2.compute.internal.domain > ip-172-31-44-253.us-west-2.compute.internal.39529: 36938 1/0/0 PTR ip-172-31-27-149.us-west-2.compute.internal. (101)
   85  07:37:09.522578 ARP, Request who-has ip-172-31-44-253.us-west-2.compute.internal tell ip-172-31-32-1.us-west-2.compute.internal, length 42
   86  07:37:09.522590 ARP, Reply ip-172-31-44-253.us-west-2.compute.internal is-at 02:60:67:63:73:db (oui Unknown), length 28
   87  07:37:09.571944 IP 152.118.27.67.43212 > ip-172-31-44-253.us-west-2.compute.internal.http: Flags [S], seq 3141424294, win 29200, options [mss 1460,sackOK,TS val 1866712 ecr 0,nop,wscale 6], length 0
   88  07:37:09.571966 IP ip-172-31-44-253.us-west-2.compute.internal.http > 152.118.27.67.43212: Flags [S.], seq 2840193959, ack 3141424295, win 26847, options [mss 8961,sackOK,TS val 3940423 ecr 1866712,nop,wscale 7], length 0
   89  07:37:09.778276 IP ip-172-31-44-253.us-west-2.compute.internal.60396 > ip-172-31-0-2.us-west-2.compute.internal.domain: 50653+ PTR? 1.32.31.172.in-addr.arpa. (42)
   90  07:37:09.779750 IP ip-172-31-0-2.us-west-2.compute.internal.domain > ip-172-31-44-253.us-west-2.compute.internal.60396: 50653 1/0/0 PTR ip-172-31-32-1.us-west-2.compute.internal. (97)
   91  07:37:09.802129 IP 152.118.27.67.43212 > ip-172-31-44-253.us-west-2.compute.internal.http: Flags [.], ack 1, win 457, options [nop,nop,TS val 1866735 ecr 3940423], length 0
   92  07:37:09.803641 IP 152.118.27.67.43212 > ip-172-31-44-253.us-west-2.compute.internal.http: Flags [P.], seq 1:218, ack 1, win 457, options [nop,nop,TS val 1866735 ecr 3940423], length 217: HTTP: POST /api/v01/post/data/add HTTP/1.1
   93  07:37:09.803661 IP ip-172-31-44-253.us-west-2.compute.internal.http > 152.118.27.67.43212: Flags [.], ack 218, win 219, options [nop,nop,TS val 3940481 ecr 1866735], length 0
   94  07:37:09.804793 IP ip-172-31-44-253.us-west-2.compute.internal.ssh > 115.178.215.137.6028: Flags [P.], seq 448:572, ack 1, win 853, options [nop,nop,TS val 3940481 ecr 4284054], length 124
   95  07:37:09.804864 IP ip-172-31-44-253.us-west-2.compute.internal.ssh > 115.178.215.137.6028: Flags [P.], seq 572:608, ack 1, win 853, options [nop,nop,TS val 3940481 ecr 4284054], length 36
   96  07:37:09.804888 IP ip-172-31-44-253.us-west-2.compute.internal.http > 152.118.27.67.43212: Flags [P.], seq 1:27, ack 218, win 219, options [nop,nop,TS val 3940481 ecr 1866735], length 26: HTTP: HTTP/1.0 400 BAD REQUEST
   97  07:37:09.804952 IP ip-172-31-44-253.us-west-2.compute.internal.http > 152.118.27.67.43212: Flags [FP.], seq 27:184, ack 218, win 219, options [nop,nop,TS val 3940481 ecr 1866735], length 157: HTTP
   98  07:37:10.032961 IP 152.118.27.67.43212 > ip-172-31-44-253.us-west-2.compute.internal.http: Flags [.], ack 27, win 457, options [nop,nop,TS val 1866758 ecr 3940481], length 0
   99  07:37:10.041019 IP 152.118.27.67.43212 > ip-172-31-44-253.us-west-2.compute.internal.http: Flags [F.], seq 218, ack 185, win 473, options [nop,nop,TS val 1866759 ecr 3940481], length 0
  100  07:37:10.041031 IP ip-172-31-44-253.us-west-2.compute.internal.http > 152.118.27.67.43212: Flags [.], ack 219, win 219, options [nop,nop,TS val 3940540 ecr 1866759], length 0
  101  07:37:10.058871 IP 115.178.215.137.6028 > ip-172-31-44-253.us-west-2.compute.internal.ssh: Flags [.], ack 608, win 1444, options [nop,nop,TS val 4286891 ecr 3940481], length 0
  102  07:37:10.058893 IP 115.178.215.137.6028 > ip-172-31-44-253.us-west-2.compute.internal.ssh: Flags [.], ack 572, win 1444, options [nop,nop,TS val 4286891 ecr 3940481], length 0
  103  07:37:34.841056 IP 152.118.27.67.43214 > ip-172-31-44-253.us-west-2.compute.internal.http: Flags [S], seq 575982695, win 29200, options [mss 1460,sackOK,TS val 1869239 ecr 0,nop,wscale 6], length 0
  104  07:37:34.841078 IP ip-172-31-44-253.us-west-2.compute.internal.http > 152.118.27.67.43214: Flags [S.], seq 676057271, ack 575982696, win 26847, options [mss 8961,sackOK,TS val 3946740 ecr 1869239,nop,wscale 7], length 0
  105  07:37:35.060514 IP 152.118.27.67.43214 > ip-172-31-44-253.us-west-2.compute.internal.http: Flags [.], ack 1, win 457, options [nop,nop,TS val 1869261 ecr 3946740], length 0
  106  07:37:35.062003 IP 152.118.27.67.43214 > ip-172-31-44-253.us-west-2.compute.internal.http: Flags [P.], seq 1:309, ack 1, win 457, options [nop,nop,TS val 1869261 ecr 3946740], length 308: HTTP: POST /api/v01/post/data/add HTTP/1.1
  107  07:37:35.062026 IP ip-172-31-44-253.us-west-2.compute.internal.http > 152.118.27.67.43214: Flags [.], ack 309, win 219, options [nop,nop,TS val 3946795 ecr 1869261], length 0
  108  07:37:35.062989 IP ip-172-31-44-253.us-west-2.compute.internal.ssh > 115.178.215.137.6028: Flags [P.], seq 608:732, ack 1, win 853, options [nop,nop,TS val 3946796 ecr 4286891], length 124
  109  07:37:35.063027 IP ip-172-31-44-253.us-west-2.compute.internal.ssh > 115.178.215.137.6028: Flags [P.], seq 732:768, ack 1, win 853, options [nop,nop,TS val 3946796 ecr 4286891], length 36
  110  07:37:35.063064 IP ip-172-31-44-253.us-west-2.compute.internal.http > 152.118.27.67.43214: Flags [P.], seq 1:27, ack 309, win 219, options [nop,nop,TS val 3946796 ecr 1869261], length 26: HTTP: HTTP/1.0 400 BAD REQUEST
  111  07:37:35.063131 IP ip-172-31-44-253.us-west-2.compute.internal.http > 152.118.27.67.43214: Flags [FP.], seq 27:184, ack 309, win 219, options [nop,nop,TS val 3946796 ecr 1869261], length 157: HTTP
  112  07:37:35.281676 IP 152.118.27.67.43214 > ip-172-31-44-253.us-west-2.compute.internal.http: Flags [.], ack 27, win 457, options [nop,nop,TS val 1869283 ecr 3946796], length 0
  113  07:37:35.292577 IP 152.118.27.67.43214 > ip-172-31-44-253.us-west-2.compute.internal.http: Flags [F.], seq 309, ack 185, win 473, options [nop,nop,TS val 1869284 ecr 3946796], length 0
  114  07:37:35.292597 IP ip-172-31-44-253.us-west-2.compute.internal.http > 152.118.27.67.43214: Flags [.], ack 310, win 219, options [nop,nop,TS val 3946853 ecr 1869284], length 0
  115  07:37:35.338864 IP 115.178.215.137.6028 > ip-172-31-44-253.us-west-2.compute.internal.ssh: Flags [.], ack 732, win 1444, options [nop,nop,TS val 4293213 ecr 3946796], length 0
  116  07:37:35.338880 IP 115.178.215.137.6028 > ip-172-31-44-253.us-west-2.compute.internal.ssh: Flags [.], ack 768, win 1444, options [nop,nop,TS val 4293213 ecr 3946796], length 0

